{
  "bindings": {
    "shot_001": {
      "character_ref_ids": [],
      "location_ref_ids": [
        "loc_01_ref_01"
      ],
      "prop_ref_ids": [],
      "style_ref_ids": [
        "style_01_ref_01"
      ]
    },
    "shot_002": {
      "character_ref_ids": [
        "char_M_ref_01"
      ],
      "location_ref_ids": [
        "loc_01_ref_01"
      ],
      "prop_ref_ids": [
        "prop_01_ref_01"
      ],
      "style_ref_ids": [
        "style_01_ref_01"
      ]
    },
    "shot_003": {
      "character_ref_ids": [
        "char_J_ref_01"
      ],
      "location_ref_ids": [
        "loc_01_ref_01"
      ],
      "prop_ref_ids": [
        "prop_02_ref_01"
      ],
      "style_ref_ids": [
        "style_01_ref_01"
      ]
    },
    "shot_004": {
      "character_ref_ids": [
        "char_M_ref_01"
      ],
      "location_ref_ids": [
        "loc_01_ref_01"
      ],
      "prop_ref_ids": [],
      "style_ref_ids": [
        "style_01_ref_01"
      ]
    },
    "shot_005": {
      "character_ref_ids": [
        "char_J_ref_01"
      ],
      "location_ref_ids": [
        "loc_01_ref_01"
      ],
      "prop_ref_ids": [],
      "style_ref_ids": [
        "style_01_ref_01"
      ]
    },
    "shot_006": {
      "character_ref_ids": [
        "char_M_ref_01"
      ],
      "location_ref_ids": [
        "loc_01_ref_01"
      ],
      "prop_ref_ids": [],
      "style_ref_ids": [
        "style_01_ref_01"
      ]
    },
    "shot_007": {
      "character_ref_ids": [
        "char_M_ref_01"
      ],
      "location_ref_ids": [
        "loc_01_ref_01"
      ],
      "prop_ref_ids": [],
      "style_ref_ids": [
        "style_01_ref_01"
      ]
    },
    "shot_008": {
      "character_ref_ids": [
        "char_M_ref_01"
      ],
      "location_ref_ids": [
        "loc_01_ref_01"
      ],
      "prop_ref_ids": [],
      "style_ref_ids": [
        "style_01_ref_01"
      ]
    }
  },
  "required_references": {
    "character_ref_ids": [
      "char_J_ref_01",
      "char_M_ref_01"
    ],
    "location_ref_ids": [
      "loc_01_ref_01"
    ],
    "prop_ref_ids": [
      "prop_01_ref_01",
      "prop_02_ref_01"
    ],
    "style_ref_ids": [
      "style_01_ref_01"
    ]
  },
  "risk_flags": [],
  "rpack_version": "0.1",
  "scene": {
    "heading_raw": "INT. APARTMENT KITCHEN - MORNING",
    "ordinal": 1,
    "scene_id": "scn_49132c8a016b"
  },
  "shots": [
    {
      "beat": "A kettle clicks off on the stove.",
      "duration_s": 3,
      "framing": "wide",
      "notes": "",
      "risk_flags": [],
      "shot_id": "shot_001"
    },
    {
      "beat": "MAYA folds a city map and slides it into a canvas tote.",
      "duration_s": 3,
      "framing": "medium",
      "notes": "",
      "risk_flags": [],
      "shot_id": "shot_002"
    },
    {
      "beat": "JONAH checks his watch near the doorway.",
      "duration_s": 3,
      "framing": "close",
      "notes": "",
      "risk_flags": [],
      "shot_id": "shot_003"
    },
    {
      "beat": "MAYA: Did you print the permit form?",
      "duration_s": 3,
      "framing": "wide",
      "notes": "",
      "risk_flags": [],
      "shot_id": "shot_004"
    },
    {
      "beat": "JONAH: It's in the blue folder.",
      "duration_s": 3,
      "framing": "medium",
      "notes": "",
      "risk_flags": [],
      "shot_id": "shot_005"
    },
    {
      "beat": "MAYA: Good. Grab the tape measure too.",
      "duration_s": 3,
      "framing": "close",
      "notes": "",
      "risk_flags": [],
      "shot_id": "shot_006"
    },
    {
      "beat": "MAYA: Good. Grab the tape measure too.",
      "duration_s": 3,
      "framing": "wide",
      "notes": "Pacing hold",
      "risk_flags": [],
      "shot_id": "shot_007"
    },
    {
      "beat": "MAYA: Good. Grab the tape measure too.",
      "duration_s": 3,
      "framing": "medium",
      "notes": "Pacing hold",
      "risk_flags": [],
      "shot_id": "shot_008"
    }
  ],
  "source": {
    "filename": "realistic.fountain",
    "hash": "421d9831099e0540cc88c3a662d77b5a412d84f7ce573bfec68f902b03ededa4"
  },
  "target_provider": "runway.gen4_image_refs",
  "target_provider_version": ""
}
